Level_Code,University,City,Course,Faculty,Local_Fees,Int_Fees,Currency,Currency_Time,Duration,Duration_Time,Full_Time,Part_Time,Prerequisite_1,Prerequisite_2,Prerequisite_3,Prerequisite_1_grade_1,Prerequisite_2_grade_2,Prerequisite_3_grade_3,Website,Course_Lang,Availability,Description,Career_Outcomes,Country,Online,Offline,Distance,Face_to_Face,Blended,Remarks,Course_Delivery_Mode,Free TAFE
MST,Deakin University,Geelong,Master of Biotechnology and Bioinformatics,"Faculty of Science, Engineering and Built Environment",28800,,AUD,Years,2,Year,Yes,Yes,WAM,Graduate Certificate,Bachelor degree,60,,,https://www.deakin.edu.au/course/master-biotechnology-bioinformatics,English,D,"This cutting-edge course provides hands-on experience and knowledge of the latest techniques in biotechnology and bioinformatics research as well as nanotechnology and bio-processing technologies. Throughout the Master of Biotechnology and Bioinformatics, you will gain experience in the use of various molecular biology techniques and bioinformatics tools, along with the opportunity to operate analytical equipment similar to those used in industrial scale production facilities.Industry connectedness is an integral part of this course and ensures students have opportunities to gain an industry perspective and establish professional networks prior to graduation.Guest lectures from key industry partners are embedded into the curriculum to provide students with an understanding of industry-engaged research and commercialisation in the biotechnology environment.Want to experience operating cutting-edge analytical equipment?","As a graduate of this course, you will be uniquely positioned to commence a PhD or actively pursue research roles in industry, education, government, policy developments and teaching. Depending on your chosen area/s of expertise, you may choose to seek employment as a bioinformatician animal scientist, botanist, chemist, food scientist, material scientist, metallurgist, molecular biologist, communications specialist, researcher or science journalist.  Potential employers include CSIRO, government research institutes and departments, private research institutes, health sector, private commercial companies, industrial research companies, universities, schools, agriculture and food sector, local councils and public service. A biotechnology qualification is also highly relevant and extremely versatile in Research and Development (R&D) roles within both public and private sector research institutes. Many biotech companies engaged in manufacturing employ qualified biotechnologists as manufacturing associates in a supervisory and management capacity. Graduates also have the opportunity to become biotech product specialist and play a valuable role in marketing and selling a variety of biotechnological products ranging from biotech instruments to reagents related to genomics or proteomics. Many biotechnologists are also engaged in the rapidly expanding field of bioinformatics and contribute towards drafting biotech patent applications under the supervision of a patent lawyer.",Australia,No,Yes,No,Yes,No,,Normal,No
MST,Deakin University,Melbourne,Master of Arts (Writing and Literature),Prospective Student Enquiry Centre,22000,,AUD,Years,2,Year,Yes,Yes,Honours,,,,,,https://www.deakin.edu.au/course/master-arts-writing-and-literature,English,D,"Hone your expertise in writing and literature and gain practical tools in critical analysis, editing and research. Whether you want to develop the skills to analyse literary works, build your creative writing practice, or craft publishable pieces of professional writing, the Master of Arts (Writing and Literature) will help fulfil your career aspirations.Want to see where a mastery of the written word can take your career?","You’ll graduate from this course with more than just advanced writing skills. You’ll also have expertise in communication, problem solving, critical thinking and research – the kind of skills employers across all industries value.This puts you in a strong position to explore a range of career pathways including:  author editor literary critic publisher advertising executive communications specialist copywriter journalist public relations practitioner English teacher (combined with an initial teaching qualification).  For more information go to 'DeakinTALENT",Australia,Yes,Yes,No,Yes,No,,Normal,No
MST,Deakin University,Melbourne,Master of Arts,Prospective Student Enquiry Centre,Fees not listed,,AUD,Years,2,Year,Yes,Yes,,,,,,,https://www.deakin.edu.au/course/master-arts,English,D,Undertake supervised research in arts and contribute to your chosen discipline area.,,Australia,Yes,Yes,No,Yes,No,,Normal,No
MST,Deakin University,Geelong,Master of Arts,Prospective Student Enquiry Centre,Fees not listed,,AUD,Years,2,Year,Yes,Yes,,,,,,,https://www.deakin.edu.au/course/master-arts,English,D,Undertake supervised research in arts and contribute to your chosen discipline area.,,Australia,Yes,Yes,No,Yes,No,,Normal,No
MST,Deakin University,Warrnambool,Master of Arts,Prospective Student Enquiry Centre,Fees not listed,,AUD,Years,2,Year,Yes,Yes,,,,,,,https://www.deakin.edu.au/course/master-arts,English,D,Undertake supervised research in arts and contribute to your chosen discipline area.,,Australia,Yes,Yes,No,Yes,No,,Normal,No
MST,Deakin University,Geelong,Master of Architecture (Research),"Faculty of Science, Engineering and Built Environment",Fees not listed,,AUD,Years,2,Year,Yes,Yes,Honours,,,H2B,,,https://www.deakin.edu.au/course/master-architecture-research,English,D,"Deepen your knowledge on a chosen topic within the field of architecture through independent, sustained and academically-supervised research.Undertake a research investigation in architecture and develop advanced skills in critical thinking, analysis and research methodologies under the supervision of internationally-recognised research staff.The School of Architecture and Built Environment specialises in critical architectural futures and its integration of current cultural studies, environmental resiliency, sustainable design, technological advancement and social and theoretical issues. You can choose topics from areas including architectural history and theory, architectural design and practice, architectural pedagogy, environmental building science, professional practice and digital design.Although the focus of the degree is on research, students are also required to complete a minimum of one unit of coursework.Ready to make a meaningful contribution through research?",,Australia,Yes,Yes,No,Yes,No,,Normal,No
MST,Deakin University,Geelong,Master of Architecture,"Faculty of Science, Engineering and Built Environment",26800,,AUD,Years,2,Year,Yes,Yes,WAM,,,60,,,https://www.deakin.edu.au/course/master-architecture,English,D,"The Master of Architecture expands your knowledge in architecture, design and innovative strategies through creativity. You will develop skills through advanced study of critical architectural futures and its integration of current cultural studies, environmental resiliency, sustainable design, technological advancement and social and theoretical issues. This prepares you for contemporary professional practice.You’ll also undertake studies of ethical, evaluative and research frameworks which underpin the architecture field.You’ll have access to Deakin’s impressive a+b studio, open 24/7, providing an open plan space to work collaboratively and develop your projects.Fabricate models in our state-of-the-art architecture workshop and experiment with technology, materials and processes. The workshop is fully equipped with 3D printers, laser cutters, CNC routers and traditional tools and machinery.Want to gain advanced practical skills through real-world projects?",Graduates will be required to complete an additional two years of work experience under the supervision of a registered architect in order to present for registration with the Architects Registration Board of Victoria and the Australian Institute of Architects.,Australia,No,Yes,No,Yes,No,,Normal,No
MST,Deakin University,Melbourne,Master of Applied Science Health,Research Administrator,Fees not listed,,AUD,Years,2,Year,Yes,Yes,Honours,,,H2B,,,https://www.deakin.edu.au/course/master-applied-science-health,English,D,Undertake research in a health related topic under the supervision of an academic staff member.,,Australia,Yes,Yes,No,Yes,No,,Normal,No
MST,Deakin University,Geelong,Master of Applied Science Health,Research Administrator,Fees not listed,,AUD,Years,2,Year,Yes,Yes,Honours,,,H2B,,,https://www.deakin.edu.au/course/master-applied-science-health,English,D,Undertake research in a health related topic under the supervision of an academic staff member.,,Australia,Yes,Yes,No,Yes,No,,Normal,No
MST,Deakin University,Melbourne,Master of Applied Science Health disease,Research Administrator,Fees not listed,,AUD,Years,2,Year,Yes,Yes,Honours,,,H2B,,,https://www.deakin.edu.au/course/master-applied-science-health-disease,English,D,Undertake research into the molecular basis of health and disease.,,Australia,Yes,Yes,No,Yes,No,,Normal,No
MST,Deakin University,Geelong,Master of Applied Science Health disease,Research Administrator,Fees not listed,,AUD,Years,2,Year,Yes,Yes,Honours,,,H2B,,,https://www.deakin.edu.au/course/master-applied-science-health-disease,English,D,Undertake research into the molecular basis of health and disease.,,Australia,Yes,Yes,No,Yes,No,,Normal,No
MST,Deakin University,Geelong,Master of Applied Artificial Intelligence (Professional),"Faculty of Science, Engineering and Built Environment",28400,,AUD,Years,2,Year,Yes,Yes,Bachelor degree,Bachelor degree,Graduate Certificate,,,,https://www.deakin.edu.au/course/master-applied-artificial-intelligence-professional,English,D,"Artificial intelligence is driving digital disruption, with new technology helping redefine many industries. Many companies are looking to take advantage of recent advances in artificial intelligence, which is creating a large demand for skilled professionals.Deakin’s Master of Applied Artificial Intelligence (Professional) will equip you with specialist knowledge and skills necessary to design and develop advanced software solutions that harness the latest advances in artificial intelligence (AI).The Master of Applied Artificial Intelligence (Professional) extends the Master of Applied Artificial Intelligence by providing students with the opportunity to further their knowledge by undertaking industry-based learning, or engaging in an in-depth research project under the supervision of our internationally-recognised research staff.Ready to drive digital disruption and harness the power of AI?","Graduates will have the specialist knowledge needed to operate as Data Scientists, AI Technology Software Engineers, AI Product Managers, AI Ethicist and grow into roles such as AI Architect.",Australia,Yes,Yes,No,Yes,No,,Normal,No
MST,Deakin University,Geelong,Master of Applied Artificial Intelligence,"Faculty of Science, Engineering and Built Environment",28400,,AUD,Years,2,Year,Yes,Yes,Honours,Graduate Certificate,Graduate Certificate,,,,https://www.deakin.edu.au/course/master-applied-artificial-intelligence,English,D,"Artificial intelligence is driving digital disruption, with new technology helping redefine many industries. Many companies are looking to take advantage of recent advances in artificial intelligence, which is creating a large demand for skilled professionals around the globe.Deakin’s Master of Applied Artificial Intelligence will equip you with specialist knowledge and skills necessary  to design and develop software solutions that harness the latest advances in artificial intelligence (AI).The Master of Applied Artificial Intelligence will develop your understanding of the technologies of artificial intelligence, deep learning, reinforcement learning, and the application of these algorithms in computer vision and speech processing.As a graduate you will be well-equipped to work on design, development, and operation of software solutions involving artificial intelligence.Ready to drive digital disruption and harness the power of AI?","Graduates will have the specialist knowledge needed to operate as Data Scientists, AI Technology Software Engineers, AI Product Managers, AI Ethicist and grow into roles such as AI Architect.",Australia,Yes,Yes,No,Yes,No,,Normal,No
MST,Deakin University,Warrnambool,Master of Advanced Clinical Practice (Paramedicine Practitioner),Prospective Student Enquiry Centre,27000,,AUD,Years,3,Year,No,Yes,WAM,,,65,,,https://www.deakin.edu.au/course/master-advanced-clinical-practice-paramedicine-practitioner,English,D,"Our Master of Advanced Clinical Practice (Paramedicine Practitioner) will set you up to become an advanced clinical practitioner and a leader in the emerging paramedicine practitioner field.Our course provides experienced paramedics with a training program and pathway that leads to an expanded scope of practice and career advancement opportunities, by meeting the necessary competencies for advanced paramedicine practice. You will be specifically trained to meet the requirements for admission to Fellowship of the Australasian College of Paramedic Practitioners*.Are you an experienced paramedic keen to take your career to the next level?","The role of paramedic practitioner provides an important new career path for experienced paramedics who would like to work more sociable hours or provide more primary care to their communities, or who can no longer meet the physical demands of working on-road. As a paramedic practitioner, you will be equipped to expand your clinical practice by conducting more comprehensive patient assessment, ordering and interpreting diagnostic tests and providing expanded health management in order to provide more complete episodes of care. As a paramedic practitioner you will possess the knowledge, skills and attitude to undertake practitioner roles within your healthcare field. You will be able to provide care complementary to that provided by GPs and nurse practitioners, particularly in regional and rural areas where collaborative models are being used to meet healthcare workforce shortfalls. Into the future, paramedic practitioners are expected to play an important role in alternative rural health Models of Care proposed due to the medical workforce shortages in rural and remote areas. Upskilled paramedic practitioners will help fill the ongoing shortfall and play a vital role in healthcare in regional areas.",Australia,Yes,Yes,No,Yes,No,,Normal,No
GDIP,Deakin University,Melbourne,Graduate Diploma of Writing and Literature,Prospective Student Enquiry Centre,22000,,AUD,Years,,Year,Yes,Yes,Graduate Certificate,,,,,,https://www.deakin.edu.au/course/graduate-diploma-writing-and-literature,English,D,"Learn how to inspire, engage and persuade your audiences with the Graduate Diploma of Writing and Literature. Build on writing skills you’ve developed at the undergraduate level or in your current role and gain a deeper understanding of the theory and history behind great pieces of writing.Want the advanced writing and analysis skills needed to unlock exciting roles in publishing, marketing and teaching?","You’ll graduate from this course with more than just advanced writing skills. You’ll also have expertise in communication, problem solving, critical thinking and research – the kind of skills employers across all industries value.This course puts you in a strong position to explore a range of career pathways, including:  author editor literary critic publisher advertising executive communications specialist copywriter journalist public relations practitioner English teacher  For those looking to continue their studies, this course is an approved pathway into the Master of Arts (Writing and Literature). For more information go to DeakinTALENT",Australia,Yes,Yes,No,Yes,No,,Normal,No
GDIP,Deakin University,Melbourne,Graduate Diploma of Visual Communication Design,Prospective Student Enquiry Centre,22000,,AUD,Years,1,Year,Yes,Yes,Graduate Certificate,,,,,,https://www.deakin.edu.au/course/graduate-diploma-visual-communication-design,English,D,"The Graduate Diploma in Visual Communication Design provides practical and theoretical skills in Visual Communication Design. This is achieved through a combination of study incorporating the contemporary thinking and techniques required for professional design practice. The course explores design's role as an agent of change and as a key link between creativity and innovation. It also addresses the social, cultural and ethical implications of design practice as well as in-depth studies of new technology in design with an emphasis on typography, form and application. Historical and contemporary graphic design processes are explored within both local and international contexts.","As a graduate of Deakin's Graduate Diploma of Visual Communication Design you will be able to communicate and produce industry and audience-relevant solutions to communication problems and opportunities which require visual design in the strategy mix. In addition, the course will develop graduates with sound theoretical grounding in cultural, business and professional skills to enable them to be effective practitioners. Graduates are likely to find work in areas such as advertising and marketing communication, communication strategy, corporate branding, design consultancies or creative boutiques. Graduates may be employed, work on a freelance basis or be self-employed. With a focus on both communication design knowledge and technical skills, graduates are better prepared for the rapidly evolving, ever-changing communication industries. For more information go to DeakinTALENT",Australia,Yes,Yes,No,Yes,No,,Normal,No
GDIP,Deakin University,Melbourne,Graduate Diploma of Sustainable Regional Development,"Faculty of Science, Engineering and Built Environment",28800,,AUD,Years,1,Year,Yes,Yes,Graduate Certificate,,,,,,https://www.deakin.edu.au/course/graduate-diploma-sustainable-regional-development,English,D,"Sustainable regional development is critical to the economic performance of both developed and developing countries. You’ll develop an in-depth understanding of the key biophysical, socioeconomic, geographic and infrastructure factors that influence the development of regions, as well as the strategic and technological tools to analyse and act on information to sustainably guide regional economic development.The Graduate Diploma of Sustainable Regional Development builds on the core units offered in the graduate certificate to provide students with an increased understanding of research planning and management, and the opportunity to undertake elective studies in a complementary area of their choosing. This course is ideally suited to those interested in acquiring knowledge about sustainable regional development, without the desire to pursue a research project.Want to drive sustainable growth in regional areas?","This course will prepare students for a career in planning (strategic, economic, rural, environmental, statutory), management (including environmental management), policy development, socio-economic and demographic analysis among others. Potential employers include: government (national, state and local) departments and agencies with a focus on regional areas, economic development, agriculture, the environment or policy development; planning, economic and environmental firms; statutory authorities such as catchment management authorities; and any organisation seeking graduates with formal training in strategic thinking and planning.",Australia,Yes,Yes,No,Yes,No,,Normal,No
GDIP,Deakin University,Melbourne,Graduate Diploma of Public Relations,Prospective Student Enquiry Centre,22000,,AUD,Years,1,Year,Yes,Yes,Graduate Certificate,,,,,,https://www.deakin.edu.au/course/graduate-diploma-public-relations,English,D,Grow your professional identity and develop advanced strategic communication skills by studying the Graduate Diploma of Public Relations. Work on industry-based projects and promotional plans that prepare you to be an adaptable public relations practitioner in a changing communications environment.Ready to upskill into a leadership role in the public relations industry?,"This course equips you with the theoretical knowledge, advanced practical skills and industry experience to pursue senior and leadership roles in the public relations industry. Promising career opportunities exist for public relations graduates in:  public relations agencies social and market research companies government educational institutions hospitals health and welfare organisations special interest groups community and cultural organisations consumer affairs.  For more information go to DeakinTALENT",Australia,Yes,Yes,No,Yes,No,,Normal,No
GDIP,Deakin University,Melbourne,Graduate Diploma of Psychology (Advanced),Prospective Student Enquiry Centre,27400,,AUD,Years,1,Year,Yes,Yes,three-year major sequence in psychology,three-year major sequence in psychology,,65,65,,https://www.deakin.edu.au/course/graduate-diploma-psychology-advanced,English,D,"If you are looking to build on the skills you’ve developed at the undergraduate level, the Graduate Diploma of Psychology (Advanced) is an APAC-accredited course that deepens your understanding of human behaviour while preparing you for a successful career as a registered psychologist.Want to explore exciting new areas of psychology and take a big step towards full registration as a psychologist?",This course is a pathway towards APAC-accredited master and doctoral-level courses that lead to registration as a psychologist. Areas of practice endorsement in psychology include:  clinical psychology (available at Deakin) clinical neuropsychology organisational psychology (available at Deakin) sport and exercise psychology forensic psychology counselling psychology community psychology  Working as a generalist psychologist might involve:  family therapy rehabilitation counselling psychological assessment  Not looking to become a registered psychologist? You will still have a broad and exciting range of career opportunities to explore when you graduate from this course. Your deep understanding of psychological assessment methods combined with your client-centred approach to practise will equip you for roles in:  community welfare and case management human resources mental health rehabilitation public health youth support disability services,Australia,Yes,Yes,No,Yes,No,,Normal,No
GDIP,Deakin University,Geelong,Graduate Diploma of Psychology (Advanced),Prospective Student Enquiry Centre,27400,,AUD,Years,1,Year,Yes,Yes,three-year major sequence in psychology,three-year major sequence in psychology,,65,65,,https://www.deakin.edu.au/course/graduate-diploma-psychology-advanced,English,D,"If you are looking to build on the skills you’ve developed at the undergraduate level, the Graduate Diploma of Psychology (Advanced) is an APAC-accredited course that deepens your understanding of human behaviour while preparing you for a successful career as a registered psychologist.Want to explore exciting new areas of psychology and take a big step towards full registration as a psychologist?",This course is a pathway towards APAC-accredited master and doctoral-level courses that lead to registration as a psychologist. Areas of practice endorsement in psychology include:  clinical psychology (available at Deakin) clinical neuropsychology organisational psychology (available at Deakin) sport and exercise psychology forensic psychology counselling psychology community psychology  Working as a generalist psychologist might involve:  family therapy rehabilitation counselling psychological assessment  Not looking to become a registered psychologist? You will still have a broad and exciting range of career opportunities to explore when you graduate from this course. Your deep understanding of psychological assessment methods combined with your client-centred approach to practise will equip you for roles in:  community welfare and case management human resources mental health rehabilitation public health youth support disability services,Australia,Yes,Yes,No,Yes,No,,Normal,No
