Level_Code,University,City,Course,Faculty,Local_Fees,Int_Fees,Currency,Currency_Time,Duration,Duration_Time,Full_Time,Part_Time,Prerequisite_1,Prerequisite_2,Prerequisite_3,Prerequisite_1_grade_1,Prerequisite_2_grade_2,Prerequisite_3_grade_3,Website,Course_Lang,Availability,Description,Career_Outcomes,Country,Online,Offline,Distance,Face_to_Face,Blended,Remarks,Course_Delivery_Mode,Free TAFE
GCERT,Deakin University,Melbourne,Graduate Certificate of Writing and Literature,Prospective Student Enquiry Centre,11000,,AUD,Years,0.5,Year,Yes,No,Bachelor degree,,,,,,https://www.deakin.edu.au/course/graduate-certificate-writing-and-literature,English,D,"Turn your love for reading and writing into a successful career with the Graduate Certificate of Writing and Literature. Get an introduction to the craft and conventions of creative writing, professional writing and publishing, and use this course as a stepping stone into the Master of Arts (Writing and Literature).Ready to explore the work of great authors while developing your own writing skills?If you’re looking to change the narrative of your career, the Graduate Certificate of Writing and Literature gives you the skills and practical experience you need to take the next step. Discover how to make your words stand out from the sea of content that exists in today’s digital age and gain a deep understanding of the theory and craft stemming from traditional literature. The course attracts a diverse group of students with a shared passion for writing, from authors to marketers, lawyers to teachers, all striving to become confident writers and brilliant communicators.The course can be used as an entry point into the Master of Arts (Writing and Literature) and includes two core units from the masters program.You’ll then choose your remaining two units from a broad list of writing and literature study areas. This allows you to build specialist skills and design a degree based on your career aspirations. Importantly, the course provides more than just writing expertise. The projects and assessment tasks you work on train you in transferable skills, including critical analysis, communication, problem solving and research – incredibly valuable in every field of work. You’ll also get to debate literature, creativity and modern writing challenges with like-minded people from different corners of business and life. This exposure to new ways of thinking helps you develop as a writer and shows you how literature can be used to make sense of different aspects of culture, place and history.","You’ll graduate from this course with more than just advanced writing skills. You’ll also have expertise in communication, problem solving, critical thinking and research – the kind of skills employers across all industries value.This course puts you in a strong position to explore a range of career pathways, including:  author editor literary critic publisher advertising executive communications specialist copywriter journalist public relations practitioner English teacher.   For those looking to continue their studies, this course is an approved pathway into the Graduate Diploma of Writing and Literature and Master of Arts (Writing and Literature). For more information go to DeakinTALENT",Australia,Yes,Yes,No,Yes,No,,Normal,No
GCERT,Deakin University,Melbourne,Graduate Certificate of Teaching English to Speakers of Other Languages (Education),Prospective Student Enquiry Centre,10500,,AUD,Years,1,Year,Yes,Yes,Bachelor degree,,,,,,https://www.deakin.edu.au/course/graduate-certificate-teaching-english-to-speakers-other-languages-education,English,D,"The Graduate Certificate of Teaching English to Speakers of other Languages (Education) develops specialised expertise for teaching English as an additional language or dialect (EAL/D) in the primary, secondary and adult sectors both inside and outside of Australia.","This course is designed to broaden the skills of those working as registered teachers in primary and secondary schools, by adding a VIT-endorsed specialist teaching method area in Teaching English to Speakers of Other Languages to their existing teacher registration. For more information go to 'DeakinTALENT '",Australia,Yes,Yes,No,Yes,No,,Normal,No
GCERT,Deakin University,Melbourne,Graduate Certificate of Teaching English to Speakers of Other Languages,Prospective Student Enquiry Centre,10500,,AUD,Years,0.5,Year,Yes,Yes,Bachelor degree,,,,,,https://www.deakin.edu.au/course/graduate-certificate-teaching-english-to-speakers-other-languages,English,D,The Graduate Certificate of Teaching English to Speakers of other Languages develops specialised skills and knowledge for professional practice in Teaching English to Speakers of other Languages (TESOL). This course is designed to provide international candidates and those who are eligible to work in adult education in Australia with a grounding in the theory and practice of Teaching English to Speakers of other Languages. It is also useful for experienced teachers in adult education who wish to develop their professional skills and knowledge in the discipline.,This course is designed to provide professional development for teaching English to speakers of other languages in adult education contexts and for teaching English overseas. For more information go to 'DeakinTALENT ',Australia,Yes,Yes,No,Yes,No,,Normal,No
GCERT,Deakin University,Melbourne,Graduate Certificate of Sustainable Regional Development,"Faculty of Science, Engineering and Built Environment",14400,,AUD,Years,1,Year,No,Yes,Bachelor degree,,,,,,https://www.deakin.edu.au/course/graduate-certificate-sustainable-regional-development,English,D,"Sustainable regional development is critical to the economic performance of both developed and developing countries. The Graduate Certificate of Sustainable Regional Development will suit students who are analytical, inquisitive, solution or policy-oriented and interested in seeking employment in areas associated with sustainable regional and rural development, strategic urban and regional planning, natural resources management, and climate change adaptation planning.","This course will prepare students for a career in planning (strategic, economic, rural, environmental, statutory), management (including environmental management), policy development, socio-economic and demographic analysis among others. Potential employers include: government (national, state and local) departments and agencies with a focus on regional areas, economic development, agriculture, the environment or policy development; planning, economic and environmental firms; statutory authorities such as catchment management authorities; and any organisation seeking graduates with formal training in strategic thinking and planning.",Australia,Yes,Yes,No,Yes,No,,Normal,No
GCERT,Deakin University,Geelong,Graduate Certificate of Research Management,"Faculty of Science, Engineering and Built Environment",14400,,AUD,Years,1,Year,No,Yes,Bachelor degree,,,,,,https://www.deakin.edu.au/course/graduate-certificate-research-management,English,D,The Graduate Certificate of Research Management is designed for professional research administrators and research policy developers wishing to further their expertise to support research in the Higher Education sector as well as industry and government departments.,"The course is designed for research administrators and policy makers. Potential employers include Universities, CSIRO, government research institutes and departments, private research institutes, and industrial research companies.",Australia,Yes,Yes,No,Yes,No,,Normal,No
GCERT,Deakin University,Melbourne,Graduate Certificate of Professional Accounting,Faculty of Business and Law,14500,,AUD,Years,0.5,Year,Yes,Yes,Bachelor degree,,,,,,https://www.deakin.edu.au/course/graduate-certificate-professional-accounting,English,D,This course enables you to study the principles of accounting and finance or take the first step towards becoming a qualified accountant.,,Australia,Yes,Yes,No,Yes,No,,Normal,No
GCERT,Deakin University,Melbourne,Graduate Certificate of Marketing,Faculty of Business and Law,14500,,AUD,Years,1,Year,No,Yes,Bachelor degree,,,,,,https://www.deakin.edu.au/course/graduate-certificate-marketing,English,D,Build on your marketing knowledge and skills by learning a solid and rational structure for marketing practice. The units in this course will help you to better structure marketing plans and programs to achieve your marketing goals.,"There is continued industry demand for marketing graduates. This is because a wide range of industries now deploy marketing as a powerful tool to add-value to their offerings. In these businesses, marketers are professionals who develop strategies to make better use of company resources, maintain and foster relationships between customers, and manage the customer experience in today’s dynamic environment.",Australia,Yes,Yes,No,Yes,No,,Normal,No
GCERT,Deakin University,Melbourne,Graduate Certificate of International Relations,Prospective Student Enquiry Centre,10800,,AUD,Years,0.5,Year,Yes,Yes,Bachelor degree,,,,,,https://www.deakin.edu.au/course/graduate-certificate-international-relations,English,D,"The forces of globalisation are generating profound  effects on many spheres of economic, social and political activity, and a  deeper knowledge of international relations is becoming necessary in many areas  of public life.   The International Relations program aims to produce graduates who are  able to demonstrate, in their professional life, high-level skills of analysis  and interpretation of global issues and events, and substantial understanding  of the complexities of contemporary international relations.  The program  is offered at graduate certificate, graduate diploma and masters levels to meet  a variety of needs in terms of entry qualifications and graduation options.",,Australia,Yes,Yes,No,Yes,No,,Normal,No
GCERT,Deakin University,Geelong,Graduate Certificate of Information Technology Management,"Faculty of Science, Engineering and Built Environment",14200,,AUD,Years,0.5,Year,Yes,Yes,,,,,,,https://www.deakin.edu.au/course/graduate-certificate-information-technology-management,English,D,"Information Technology is driving digital disruption, with new technology helping redefine many industries. To successfully take advantage of the opportunities that information technology offers, businesses need skilled staff who can lead and manage IT projects, services, and departments.",Graduates of the Graduate Certificate of Information Technology Management will be able to engage effectively with specialists in the area of IT project management.,Australia,Yes,Yes,No,Yes,No,,Normal,No
GCERT,Deakin University,Melbourne,Graduate Certificate of Information Technology,"Faculty of Science, Engineering and Built Environment",14200,,AUD,Years,0.5,Year,Yes,Yes,Bachelor degree,,,,,,https://www.deakin.edu.au/course/graduate-certificate-information-technology,English,D,"As a postgraduate introduction to IT, this course is ideal for students without a computing background, as well as those who’d like to bolster their industry experience with a recognised academic qualification.Developed in consultation with industry, this course will teach you how information technologies relate to everyday business operations within organisations. You’ll also gain essential IT skills, from software design and engineering to information retrieval and web development.","In today's IT job market, multi-skilling, multi-tasking and cross-skilling are highly valued by employers and Deakin graduates are best placed for a successful career in this industry. Our graduates are well-rounded IT professionals with the ability to meet the future needs of this ever-evolving, fast-moving industry.",Australia,Yes,Yes,No,Yes,No,,Normal,No
GCERT,Deakin University,Geelong,Graduate Certificate of Information Technology,"Faculty of Science, Engineering and Built Environment",14200,,AUD,Years,0.5,Year,Yes,Yes,Bachelor degree,,,,,,https://www.deakin.edu.au/course/graduate-certificate-information-technology,English,D,"As a postgraduate introduction to IT, this course is ideal for students without a computing background, as well as those who’d like to bolster their industry experience with a recognised academic qualification.Developed in consultation with industry, this course will teach you how information technologies relate to everyday business operations within organisations. You’ll also gain essential IT skills, from software design and engineering to information retrieval and web development.","In today's IT job market, multi-skilling, multi-tasking and cross-skilling are highly valued by employers and Deakin graduates are best placed for a successful career in this industry. Our graduates are well-rounded IT professionals with the ability to meet the future needs of this ever-evolving, fast-moving industry.",Australia,Yes,Yes,No,Yes,No,,Normal,No
GCERT,Deakin University,Melbourne,Graduate Certificate of Information Systems,Faculty of Business and Law,14200,,AUD,Years,0.5,Year,Yes,Yes,Bachelor degree,,,,,,https://www.deakin.edu.au/course/graduate-certificate-information-systems,English,D,Take your understanding of information systems and commerce to the next level with Deakin’s Graduate Certificate of Information Systems.,,Australia,Yes,Yes,No,Yes,No,,Normal,No
GCERT,Deakin University,Melbourne,Graduate Certificate of Humanitarian Assistance,Prospective Student Enquiry Centre,11100,,AUD,Years,1,Year,No,Yes,Bachelor degree,,,,,,https://www.deakin.edu.au/course/graduate-certificate-humanitarian-assistance,English,D,"Good humanitarian action is intended to save lives, alleviate suffering and maintain human dignity before during and after disasters and conflict. This is informed by principles of Humanity; Impartiality; Neutrality and Independence.","The Graduate Certificate of Humanitarian Assistance will improve your understanding of the humanitarian system and provide an opportunity for potential employment in the humanitarian system. Employment in the humanitarian field is expanding, including in related areas, such as teaching, training, organisation and community capacity building, disaster risk reduction assessment and programming, consulting enterprises, journalism and communications, project management and community development. Opportunities are available in government and non-government agencies concerned with the provision of all aspects of emergency and humanitarian action including service provision, logistical support, communications, program management and support, community engagement and support, funding, coordination, monitoring and evaluation. For more information go to DeakinTALENT",Australia,Yes,Yes,No,Yes,No,,Normal,No
GCERT,Deakin University,Melbourne,Graduate Certificate of Health Promotion,Prospective Student Enquiry Centre,13000,,AUD,Years,1,Year,No,Yes,,,,,,,https://www.deakin.edu.au/course/graduate-certificate-health-promotion,English,D,Encourage people to take control of their health and improve their wellbeing.,"Following successful completion of the Graduate Certificate of Health Promotion, you will be qualified to take advantage of the career opportunities that exist world wide in national and international health organisations; medium-sized businesses; multinational corporations; community organisations; human services agencies; local, state and federal government departments; statutory authorities; and Non-Government Organisations (NGOs).",Australia,Yes,Yes,No,Yes,No,,Normal,No
GCERT,Deakin University,Melbourne,Graduate Certificate of Health Economics,Prospective Student Enquiry Centre,13100,,AUD,Years,0.5,Year,Yes,Yes,,,,,,,https://www.deakin.edu.au/course/graduate-certificate-health-economics,English,D,"The Graduate Certificate of Health Economics gives graduates from a range of disciplines such as nursing and pharmacy through to business administration and health management and beyond, a foundation in health economics. It introduces microeconomic concepts relevant to health and economic evaluation to understand the complexities of resource allocation in the health system. Students will learn skills in economic evaluation of health interventions, resource allocation and priority setting.",,Australia,Yes,Yes,No,Yes,No,,Normal,No
GCERT,Deakin University,Melbourne,Graduate Certificate of Financial Planning,Student Services Network,13800,,AUD,Years,1,Year,No,Yes,Bachelor degree,,,,,,https://www.deakin.edu.au/course/graduate-certificate-financial-planning,English,D,"Be ready for Australia’s financial planning reforms by studying the Graduate Certificate of Financial Planning, which develops the decision-making skills needed to provide practical and professionally responsible financial advice to your client.If you’re a financial planner returning to study, why not choose a course that’s purpose-built to help you stay ahead of industry requirements?","Whether you’re currently working in the industry or looking to move into a financial planning role, you’ll be prepared to excel in a variety of positions including:  financial adviser/planner insurance adviser paraplanner business development manager superannuation consultant portfolio analyst investment banker claims administrator compliance manager risk adviser.",Australia,Yes,Yes,No,Yes,No,,Normal,No
GCERT,Deakin University,Melbourne,Graduate Certificate of Film and Television,Prospective Student Enquiry Centre,11000,,AUD,Years,0.5,Year,Yes,Yes,,,,,,,https://www.deakin.edu.au/course/graduate-certificate-film-and-television,English,D,The Graduate Certificate of Film and Television provides students with an opportunity to acquire specialist knowledge and expand their skills in the ever-changing media production industries.,"Graduates will be well placed for a successful career in media production from film making advertising, sports media, and broadcast television to the production of online content.",Australia,No,Yes,No,Yes,No,,Normal,No
GCERT,Deakin University,Melbourne,Graduate Certificate of Data Science,"Faculty of Science, Engineering and Built Environment",14200,,AUD,Years,1,Year,No,Yes,Graduate Certificate,,,,,,https://www.deakin.edu.au/course/graduate-certificate-data-science,English,D,"The Graduate Certificate of Data Science covers modern data science concepts, statistical data analysis, descriptive analytics and machine learning to equip you with the theory, methodologies, techniques and tools of modern data science and the ability to confidently work with any type of data, to identify trends, make predictions, draw conclusions, drive innovations, make decisions, and to share information that influences people.","Graduates of this course are prepared for professional employment across all sectors as data science specialists.  Professionals with a solid knowledge in data science and strong skills for analysing and interpreting data in today's data-rich economy are in high demand and may find careers as data analysts, data scientists, analytics programmers, analytics managers, analytics consultants, business analysts, management advisors, management analysts, business advisors and strategists, marketing managers, market research analysts and marketing specialists.",Australia,Yes,Yes,No,Yes,No,,Normal,No
GCERT,Deakin University,Melbourne,Graduate Certificate of Data Analytics,"Faculty of Science, Engineering and Built Environment",14200,,AUD,Years,0.5,Year,Yes,Yes,Bachelor degree,,,,,,https://www.deakin.edu.au/course/graduate-certificate-data-analytics,English,D,"The Graduate Certificate of Data Analytics is ideal for students without a computing background, as well as those who’d like to bolster their industry experience with a recognised academic qualification.With a focus on fundamental data analytics, this course covers foundation skills, security and privacy issues, research and development, and real world analytics.","Deakin's Graduate Certificate of Data Analytics prepares students for professional employment across all sectors as data analytics specialists.  Data analysts may find employment with organisations who make data-driven decisions, in areas including software development, pharmaceutical discovery, marketing, consulting, manufacturing,financial services, telecoms, e-commerce, retail, health care, public services, information security and more.",Australia,Yes,Yes,No,Yes,No,,Normal,No
GCERT,Deakin University,Geelong,Graduate Certificate of Cyber Security,"Faculty of Science, Engineering and Built Environment",14200,,AUD,Years,1,Year,No,Yes,Bachelor degree,Graduate Certificate,,,,,https://www.deakin.edu.au/course/graduate-certificate-cyber-security,English,D,"In today’s digital world, cyber-attacks are becoming everyday occurrences. Cyber security professionals are employed to protect organisations in all sectors from cyber-attacks and are in high demand. This course can prepare you for a successful security career anywhere in the cyber world.Throughout the Graduate Certificate of Cyber Security, you will learn how to confront cyber security challenges and understand what the key issues are.",Career options are varied so you could work anywhere in the world as a:  security analyst project manager security system manager cryptographer security consultant security system developer or programmer information security auditor business continuity or IT security engineer.,Australia,Yes,Yes,No,Yes,No,,Normal,No
GCERT,Deakin University,Melbourne,Graduate Certificate of Cyber Law,Faculty of Business and Law,14900,,AUD,Years,1,Year,No,Yes,Bachelor degree,,,,,,https://www.deakin.edu.au/course/graduate-certificate-cyber-law,English,D,"The Graduate Certificate of Cyber Law prepares you for the evolving legal challenges of the digital world. Develop technical skills in both cyber technology law and IT, and use your dual expertise to protect and defend victims of cybercrime.Want to take your legal career to the next level with a qualification that’s sought-after across all organisations with a digital footprint?","Cybercrime is at an all-time high. Government and businesses, big and small, are in need of professionals who can identify risks before they happen and provide legal protection for their digital operations. Graduates of this course will have the legal acumen and technical IT knowledge to explore a variety of roles including:  cyber lawyer cybersecurity consultant cryptographer business analyst policy adviser security analyst.",Australia,Yes,Yes,No,Yes,No,,Normal,No
GCERT,Deakin University,Melbourne,Graduate Certificate of Cultural Heritage and Museum Studies,Prospective Student Enquiry Centre,10900,,AUD,Years,1,Year,Yes,Yes,Bachelor degree,,,,,,https://www.deakin.edu.au/course/graduate-certificate-cultural-heritage-and-museum-studies,English,D,Gain the fundamental skills and knowledge needed to kick-start your career working in the cultural heritage and museum sector. You’ll become familiar with current theory and practice and be ready for further study.,"The Graduate Certificate of Cultural Heritage and Museum Studies gives you the foundation of knowledge needed to enter the cultural heritage and museum sector ready to thrive. As a graduate, you may find employment in museums, heritage institutions, government agencies, private corporations, community organisations and in private practice. Typical job titles include:  curator heritage officer registrar public programs officer researcher project officer.  Alternatively, completion of the course qualifies your entry into the one-year Master of Cultural Heritage and Museum Studies or two-year Master of Cultural Heritage and Museum Studies (Professional). These programs give you the freedom to focus your studies on a specific area of interest, driving your career in the direction you wish to go. For more information go to DeakinTALENT",Australia,Yes,Yes,No,Yes,No,,Normal,No
GCERT,Deakin University,Melbourne,Graduate Certificate of Creative Arts,Prospective Student Enquiry Centre,11100,,AUD,Years,0.5,Year,Yes,Yes,Bachelor degree,,,,,,https://www.deakin.edu.au/course/graduate-certificate-creative-arts,English,D,Study a Graduate Certificate of Creative Arts and develop your creative practice in one of the seven disciplines offered at Deakin. Develop your knowledge and skills in creative arts research in relation to your creative practice. Find out more about the course online and apply today.,"Graduates of the Graduate Certificate of Creative Arts, will possess advanced or expert knowledge and skills to work in a range of industry contexts spanning the Creative Arts within diverse organisations (non-profit through to corporate). Graduates will be able to undertake many roles which may be categorised from entrepreneurial, consulting, curatorial, through to art production within organisations such as museums and galleries, government (federal, state and local), and boutique arts companies. There are also many opportunities to be found in festivals, curatorial and community projects typically funded or auspiced by government and philanthropic entities. Organisations are looking for graduates who have knowledge and skills developed in a learning environment enhanced by contemporary and up-to-date production facilities, equipment and spaces (which Deakin provides). Graduates will also be well equipped to undertake independent artist careers. For more information go to DeakinTALENT",Australia,No,Yes,No,Yes,No,,Normal,No
